{"$id":"https://github.com/thedanieltan/financial-model-router-oss/blob/main/fmr/contracts/workflow-acceptance-corpus.v1.schema.json","$schema":"https://json-schema.org/draft/2020-12/schema","additionalProperties":false,"properties":{"cases":{"items":{"additionalProperties":false,"properties":{"case_id":{"minLength":1,"type":"string"},"data_classification":{"enum":["synthetic","anonymized"]},"expected":{"additionalProperties":false,"properties":{"blueprint_id":{"type":"string"},"missing_requirements":{"items":{"type":"string"},"type":"array","uniqueItems":true},"status":{"enum":["ready","ready_with_approval_gates","blocked"]},"step_states":{"additionalProperties":{"enum":["ready","blocked","awaiting_approval","waiting_on_dependencies"]},"type":"object"}},"required":["blueprint_id","status","step_states","missing_requirements"],"type":"object"},"request":{"$ref":"finance-workflow-request.v1.schema.json"},"rerun_probe":{"type":["object","null"]}},"required":["case_id","data_classification","request","expected","rerun_probe"],"type":"object"},"minItems":1,"type":"array"},"contract_version":{"const":"workflow-acceptance-corpus.v1"},"corpus_id":{"minLength":1,"type":"string"},"corpus_version":{"minLength":1,"type":"string"},"practitioner_reviews":{"items":{"$ref":"workflow-practitioner-review.v1.schema.json"},"type":"array"}},"required":["contract_version","corpus_id","corpus_version","cases","practitioner_reviews"],"title":"FMR workflow acceptance corpus v1","type":"object"}
