{"cases":[{"case_id":"monthly-forecast","data_classification":"synthetic","expected":{"blueprint_id":"monthly_forecast_update","missing_requirements":[],"status":"ready_with_approval_gates","step_states":{"assemble_outputs":"waiting_on_dependencies","refresh_forecast":"ready","refresh_statements":"ready","review_forecast":"awaiting_approval","validate_sources":"ready"}},"request":{"available_assumptions":["capital_expenditure_rate","depreciation_rate","forecast_horizon","operating_cost_growth_rate","operating_margin_rate","revenue_growth_rate","scenario","scenario_adjustments","tax_rate","working_capital_rate"],"available_data":["balance_sheet_history","capital_expenditure","cash_flow_history","debt_schedule","income_statement_history","operating_cost_drivers","revenue_drivers","working_capital"],"constraints":{"local_only":true,"network_allowed":false,"open_source_only":true},"context":{},"contract_version":"finance-workflow-request.v1","entity_id":"synthetic-company","industry":null,"input_references":{"canonical":{"contract_version":"canonical-financial-data.v2","path":"/tmp/fmr-workflow-canonical.json","sha256":"0000000000000000000000000000000000000000000000000000000000000000"}},"objective":"Update the full year forecast using June actuals","output_formats":["json"],"policy_name":"default","reporting_period":"2026-06","requested_outputs":["rolling_forecast","cash_outlook","management_pack"],"role":"fp_and_a"},"rerun_probe":{"changed_inputs":["revenue_growth_rate"],"invalidated_steps":["assemble_outputs","refresh_forecast","refresh_statements","review_forecast"],"reusable_steps":["validate_sources"]}},{"case_id":"scenario-downside","data_classification":"synthetic","expected":{"blueprint_id":"scenario_analysis","missing_requirements":[],"status":"ready_with_approval_gates","step_states":{"review_scenario":"awaiting_approval","run_scenario":"ready","validate_sources":"ready"}},"request":{"available_assumptions":["forecast_horizon","operating_cost_growth_rate","revenue_growth_rate","scenario","scenario_adjustments"],"available_data":["income_statement_history","operating_cost_drivers","revenue_drivers"],"constraints":{"local_only":true,"network_allowed":false,"open_source_only":true},"context":{},"contract_version":"finance-workflow-request.v1","entity_id":"synthetic-company","industry":null,"input_references":{"canonical":{"contract_version":"canonical-financial-data.v2","path":"/tmp/fmr-workflow-canonical.json","sha256":"0000000000000000000000000000000000000000000000000000000000000000"}},"objective":"Run a downside scenario with slower sales and delayed hiring","output_formats":["json"],"policy_name":"default","reporting_period":"2026-06","requested_outputs":["scenario_comparison","downside_case"],"role":"fp_and_a"},"rerun_probe":{"changed_inputs":["scenario_adjustments"],"invalidated_steps":["review_scenario","run_scenario"],"reusable_steps":["validate_sources"]}},{"case_id":"operating-dcf","data_classification":"synthetic","expected":{"blueprint_id":"operating_company_valuation","missing_requirements":[],"status":"ready_with_approval_gates","step_states":{"calculate_dcf":"ready","review_valuation":"awaiting_approval","validate_sources":"ready"}},"request":{"available_assumptions":["capital_expenditure_rate","depreciation_rate","discount_rate","forecast_horizon","net_debt","operating_margin_rate","revenue_growth_rate","tax_rate","terminal_growth_rate","terminal_value_assumption","working_capital_rate"],"available_data":["capital_expenditure","cash_flow_history","income_statement_history","net_debt","revenue_drivers","working_capital"],"constraints":{"local_only":true,"network_allowed":false,"open_source_only":true},"context":{},"contract_version":"finance-workflow-request.v1","entity_id":"synthetic-company","industry":null,"input_references":{"canonical":{"contract_version":"canonical-financial-data.v2","path":"/tmp/fmr-workflow-canonical.json","sha256":"0000000000000000000000000000000000000000000000000000000000000000"}},"objective":"Value the operating company using a DCF and show enterprise and equity value","output_formats":["json"],"policy_name":"default","reporting_period":"2026-06","requested_outputs":["enterprise_value","equity_value","operating_company_dcf"],"role":"private_equity"},"rerun_probe":null},{"case_id":"debt-capacity","data_classification":"synthetic","expected":{"blueprint_id":"debt_capacity_refresh","missing_requirements":[],"status":"ready_with_approval_gates","step_states":{"calculate_debt_capacity":"ready","review_debt":"awaiting_approval","validate_sources":"ready"}},"request":{"available_assumptions":["annual_repayment","covenant_thresholds","ebitda_growth_rate","forecast_horizon","interest_rate_assumption","maximum_leverage_ratio","minimum_debt_service_coverage","opening_debt","repayment_terms"],"available_data":["cash_flow_history","debt_schedule","income_statement_history","liquidity_position"],"constraints":{"local_only":true,"network_allowed":false,"open_source_only":true},"context":{},"contract_version":"finance-workflow-request.v1","entity_id":"synthetic-company","industry":null,"input_references":{"canonical":{"contract_version":"canonical-financial-data.v2","path":"/tmp/fmr-workflow-canonical.json","sha256":"0000000000000000000000000000000000000000000000000000000000000000"}},"objective":"Refresh debt capacity, leverage and covenant headroom","output_formats":["json"],"policy_name":"default","reporting_period":"2026-06","requested_outputs":["debt_capacity","refinancing_analysis","covenant_headroom"],"role":"finance_manager"},"rerun_probe":null},{"case_id":"lbo-blocked","data_classification":"synthetic","expected":{"blueprint_id":"leveraged_buyout_screening","missing_requirements":["route_status:unsupported_family"],"status":"blocked","step_states":{"build_lbo":"blocked","validate_sources":"ready"}},"request":{"available_assumptions":["entry_assumptions","debt_terms","exit_assumptions"],"available_data":["historical_financials"],"constraints":{"local_only":true,"network_allowed":false,"open_source_only":true},"context":{},"contract_version":"finance-workflow-request.v1","entity_id":"synthetic-company","industry":null,"input_references":{"canonical":{"contract_version":"canonical-financial-data.v2","path":"/tmp/fmr-workflow-canonical.json","sha256":"0000000000000000000000000000000000000000000000000000000000000000"}},"objective":"Build an LBO acquisition returns screen","output_formats":["json"],"policy_name":"default","reporting_period":"2026-06","requested_outputs":["lbo_model","moic","irr","sources_and_uses"],"role":"private_equity"},"rerun_probe":null},{"case_id":"project-finance-blocked","data_classification":"synthetic","expected":{"blueprint_id":"project_finance_debt_sizing","missing_requirements":["route_status:unsupported_family"],"status":"blocked","step_states":{"size_project_debt":"blocked","validate_project_sources":"ready"}},"request":{"available_assumptions":["coverage_targets"],"available_data":["project_cash_flow","construction_schedule","debt_terms"],"constraints":{"local_only":true,"network_allowed":false,"open_source_only":true},"context":{},"contract_version":"finance-workflow-request.v1","entity_id":"synthetic-company","industry":null,"input_references":{"canonical":{"contract_version":"canonical-financial-data.v2","path":"/tmp/fmr-workflow-canonical.json","sha256":"0000000000000000000000000000000000000000000000000000000000000000"}},"objective":"Size and sculpt project finance debt to DSCR and LLCR targets","output_formats":["json"],"policy_name":"default","reporting_period":"2026-06","requested_outputs":["debt_sizing","debt_sculpting","dscr","llcr","plcr"],"role":"project_finance"},"rerun_probe":null},{"case_id":"venture-follow-on-blocked","data_classification":"synthetic","expected":{"blueprint_id":"venture_follow_on_analysis","missing_requirements":["route_status:unsupported_family"],"status":"blocked","step_states":{"model_financing_round":"blocked","validate_sources":"ready"}},"request":{"available_assumptions":["round_terms","exit_scenarios"],"available_data":["cap_table"],"constraints":{"local_only":true,"network_allowed":false,"open_source_only":true},"context":{},"contract_version":"finance-workflow-request.v1","entity_id":"synthetic-company","industry":null,"input_references":{"canonical":{"contract_version":"canonical-financial-data.v2","path":"/tmp/fmr-workflow-canonical.json","sha256":"0000000000000000000000000000000000000000000000000000000000000000"}},"objective":"Model the follow on financing round, pro rata ownership and dilution","output_formats":["json"],"policy_name":"default","reporting_period":"2026-06","requested_outputs":["dilution","ownership","follow_on_returns","cap_table"],"role":"venture_capital"},"rerun_probe":null}],"contract_version":"workflow-acceptance-corpus.v1","corpus_id":"synthetic-practitioner-workflows","corpus_version":"1.0.0","practitioner_reviews":[]}
